No.,Time,Source,Destination,Protocol,Length,Info
2,0.006362436,141.22.70.75,141.22.192.100,DNS,76,Standard query 0x73c3 A mtalk.google.com
3,0.006385392,141.22.70.75,141.22.192.101,DNS,76,Standard query 0x73c3 A mtalk.google.com
4,0.009384719,141.22.192.100,141.22.70.75,DNS,257,Standard query response 0x73c3 A mtalk.google.com CNAME mobile-gtalk.l.google.com A 108.177.119.188 NS ns1.google.com NS ns2.google.com NS ns3.google.com NS ns4.google.com A 216.239.32.10 A 216.239.34.10 A 216.239.36.10 A 216.239.38.10
6,0.009915188,141.22.192.101,141.22.70.75,DNS,257,Standard query response 0x73c3 A mtalk.google.com CNAME mobile-gtalk.l.google.com A 108.177.119.188 NS ns4.google.com NS ns1.google.com NS ns2.google.com NS ns3.google.com A 216.239.32.10 A 216.239.34.10 A 216.239.36.10 A 216.239.38.10
18,0.100916645,141.22.70.75,141.22.192.100,DNS,84,Standard query 0xb7da A translate.googleapis.com
19,0.104111518,141.22.192.100,141.22.70.75,DNS,243,Standard query response 0xb7da A translate.googleapis.com A 108.177.119.95 NS ns3.google.com NS ns4.google.com NS ns1.google.com NS ns2.google.com A 216.239.32.10 A 216.239.34.10 A 216.239.36.10 A 216.239.38.10
49,0.201349852,141.22.70.75,141.22.192.100,DNS,78,Standard query 0x3997 A www.googleapis.com
51,0.209004324,141.22.192.100,141.22.70.75,DNS,264,Standard query response 0x3997 A www.googleapis.com CNAME googleapis.l.google.com A 108.177.119.95 NS ns3.google.com NS ns4.google.com NS ns1.google.com NS ns2.google.com A 216.239.32.10 A 216.239.34.10 A 216.239.36.10 A 216.239.38.10
55,0.226055324,141.22.70.75,141.22.192.100,DNS,79,Standard query 0x641e A accounts.google.com
56,0.227899466,141.22.70.75,141.22.192.100,DNS,73,Standard query 0xf11f A www.google.de
60,0.229731250,141.22.192.100,141.22.70.75,DNS,231,Standard query response 0x641e A accounts.google.com A 108.177.119.84 NS ns4.google.com NS ns1.google.com NS ns2.google.com NS ns3.google.com A 216.239.32.10 A 216.239.34.10 A 216.239.36.10 A 216.239.38.10
62,0.230338749,141.22.192.100,141.22.70.75,DNS,235,Standard query response 0xf11f A www.google.de A 216.58.213.227 NS ns4.google.com NS ns1.google.com NS ns2.google.com NS ns3.google.com A 216.239.32.10 A 216.239.34.10 A 216.239.36.10 A 216.239.38.10
97,0.323169936,141.22.70.75,141.22.192.100,DNS,87,Standard query 0xda96 A safebrowsing.googleapis.com
103,0.326535046,141.22.192.100,141.22.70.75,DNS,246,Standard query response 0xda96 A safebrowsing.googleapis.com A 108.177.119.95 NS ns2.google.com NS ns3.google.com NS ns4.google.com NS ns1.google.com A 216.239.32.10 A 216.239.34.10 A 216.239.36.10 A 216.239.38.10
241,0.801432418,141.22.70.75,141.22.192.100,DNS,84,Standard query 0xa756 A www.google-analytics.com
242,0.803841858,141.22.70.75,141.22.192.100,DNS,83,Standard query 0x970e A stats.g.doubleclick.net
243,0.805516813,141.22.192.100,141.22.70.75,DNS,360,Standard query response 0xa756 A www.google-analytics.com CNAME www-google-analytics.l.google.com A 108.177.119.100 A 108.177.119.101 A 108.177.119.102 A 108.177.119.113 A 108.177.119.138 A 108.177.119.139 NS ns2.google.com NS ns3.google.com NS ns4.google.com NS ns1.google.com A 216.239.32.10 A 216.239.34.10 A 216.239.36.10 A 216.239.38.10
245,0.807340805,141.22.192.100,141.22.70.75,DNS,315,Standard query response 0x970e A stats.g.doubleclick.net CNAME stats.l.doubleclick.net A 108.177.119.154 A 108.177.119.155 A 108.177.119.156 A 108.177.119.157 NS ns4.google.com NS ns1.google.com NS ns2.google.com NS ns3.google.com A 216.239.32.10 A 216.239.34.10 A 216.239.36.10 A 216.239.38.10
325,1.007482879,141.22.70.75,141.22.192.100,DNS,79,Standard query 0x96f5 A clients2.google.com
326,1.011169736,141.22.192.100,141.22.70.75,DNS,335,Standard query response 0x96f5 A clients2.google.com CNAME clients.l.google.com A 108.177.119.101 A 108.177.119.102 A 108.177.119.113 A 108.177.119.138 A 108.177.119.139 A 108.177.119.100 NS ns1.google.com NS ns2.google.com NS ns3.google.com NS ns4.google.com A 216.239.32.10 A 216.239.34.10 A 216.239.36.10 A 216.239.38.10
327,1.013070605,141.22.70.75,141.22.192.100,DNS,73,Standard query 0x63aa A api.twitch.tv
329,1.015824837,141.22.70.75,141.22.192.100,DNS,72,Standard query 0x53c5 A api.azubu.tv
330,1.016270897,141.22.192.100,141.22.70.75,DNS,540,Standard query response 0x63aa A api.twitch.tv CNAME api-twitch-tv.web-cdn.twitch.tv CNAME api.twitch.tv.edgekey.net CNAME e9221.e2.akamaiedge.net A 104.85.250.198 NS n2e2.akamaiedge.net NS n3e2.akamaiedge.net NS n4e2.akamaiedge.net NS n5e2.akamaiedge.net NS n6e2.akamaiedge.net NS n7e2.akamaiedge.net NS a0e2.akamaiedge.net NS a1e2.akamaiedge.net NS n0e2.akamaiedge.net NS n1e2.akamaiedge.net AAAA 2600:1480:e800::c0 AAAA 2600:1480:e800::c0 A 88.221.81.192 A 80.157.150.135 A 80.157.150.135 A 80.157.150.134 A 80.157.150.134 A 80.157.150.140
331,1.016527214,141.22.70.75,141.22.192.100,DNS,73,Standard query 0x05be A api.hitbox.tv
332,1.018747191,141.22.70.75,141.22.192.100,DNS,77,Standard query 0x6444 A gdata.youtube.com
334,1.019165313,141.22.192.100,141.22.70.75,DNS,304,Standard query response 0x53c5 A api.azubu.tv A 54.225.185.25 NS ns-1468.awsdns-55.org NS ns-1619.awsdns-10.co.uk NS ns-180.awsdns-22.com NS ns-886.awsdns-46.net A 205.251.195.118 A 205.251.197.188 A 205.251.198.83 AAAA 2600:9000:5306:5300::1
336,1.025449378,141.22.192.100,141.22.70.75,DNS,489,Standard query response 0x05be A api.hitbox.tv CNAME www-561956676.us-east-1.elb.amazonaws.com A 107.21.211.51 A 107.22.209.175 A 107.22.225.154 NS ns-934.awsdns-52.net NS ns-1119.awsdns-11.org NS ns-1793.awsdns-32.co.uk NS ns-235.awsdns-29.com A 205.251.192.235 AAAA 2600:9000:5300:eb00::1 A 205.251.195.166 AAAA 2600:9000:5303:a600::1 A 205.251.196.95 AAAA 2600:9000:5304:5f00::1 A 205.251.199.1 AAAA 2600:9000:5307:100::1
349,1.039836410,141.22.192.100,141.22.70.75,DNS,257,Standard query response 0x6444 A gdata.youtube.com CNAME www4.l.google.com A 108.177.119.118 NS ns3.google.com NS ns4.google.com NS ns1.google.com NS ns2.google.com A 216.239.32.10 A 216.239.34.10 A 216.239.36.10 A 216.239.38.10
458,1.231419668,141.22.70.75,141.22.192.100,DNS,90,Standard query 0x4dcb A loadbalancer-api.herokuapp.com
466,1.241464531,141.22.192.100,141.22.70.75,DNS,475,Standard query response 0x4dcb A loadbalancer-api.herokuapp.com A 54.75.238.140 A 54.195.251.101 A 54.217.250.27 A 54.228.187.187 A 54.228.202.153 A 54.228.238.44 A 54.228.240.19 A 176.34.101.252 NS ns-662.awsdns-18.net NS ns-1378.awsdns-44.org NS ns-1624.awsdns-11.co.uk NS ns-505.awsdns-63.com A 205.251.193.249 A 205.251.194.150 AAAA 2600:9000:5302:9600::1 A 205.251.197.98 AAAA 2600:9000:5305:6200::1 A 205.251.198.88
548,1.642606470,141.22.70.75,141.22.192.100,DNS,79,Standard query 0x5c3e A clients5.google.com
549,1.645241396,141.22.70.75,141.22.192.100,DNS,74,Standard query 0x0f10 A ogs.google.com
550,1.645966290,141.22.192.100,141.22.70.75,DNS,335,Standard query response 0x5c3e A clients5.google.com CNAME clients.l.google.com A 108.177.119.138 A 108.177.119.139 A 108.177.119.100 A 108.177.119.101 A 108.177.119.102 A 108.177.119.113 NS ns4.google.com NS ns1.google.com NS ns2.google.com NS ns3.google.com A 216.239.32.10 A 216.239.34.10 A 216.239.36.10 A 216.239.38.10
552,1.648563386,141.22.192.100,141.22.70.75,DNS,327,Standard query response 0x0f10 A ogs.google.com CNAME www3.l.google.com A 108.177.119.102 A 108.177.119.113 A 108.177.119.138 A 108.177.119.139 A 108.177.119.100 A 108.177.119.101 NS ns3.google.com NS ns4.google.com NS ns1.google.com NS ns2.google.com A 216.239.32.10 A 216.239.34.10 A 216.239.36.10 A 216.239.38.10
612,1.990228789,141.22.70.75,141.22.192.100,DNS,74,Standard query 0xcb19 A www.google.com
613,1.992384084,141.22.192.100,141.22.70.75,DNS,226,Standard query response 0xcb19 A www.google.com A 216.58.213.228 NS ns1.google.com NS ns2.google.com NS ns3.google.com NS ns4.google.com A 216.239.32.10 A 216.239.34.10 A 216.239.36.10 A 216.239.38.10
652,2.132158535,141.22.70.75,141.22.192.100,DNS,87,Standard query 0x8c53 A googleads.g.doubleclick.net
653,2.134869497,141.22.192.100,141.22.70.75,DNS,322,Standard query response 0x8c53 A googleads.g.doubleclick.net CNAME pagead46.l.doubleclick.net A 108.177.127.155 A 108.177.127.156 A 108.177.127.157 A 108.177.127.154 NS ns3.google.com NS ns4.google.com NS ns1.google.com NS ns2.google.com A 216.239.32.10 A 216.239.34.10 A 216.239.36.10 A 216.239.38.10
702,2.574129630,141.22.70.75,141.22.192.100,DNS,79,Standard query 0x243e A clients4.google.com
703,2.577260309,141.22.192.100,141.22.70.75,DNS,335,Standard query response 0x243e A clients4.google.com CNAME clients.l.google.com A 108.177.119.101 A 108.177.119.102 A 108.177.119.113 A 108.177.119.138 A 108.177.119.139 A 108.177.119.100 NS ns1.google.com NS ns2.google.com NS ns3.google.com NS ns4.google.com A 216.239.32.10 A 216.239.34.10 A 216.239.36.10 A 216.239.38.10
771,6.979368493,141.22.70.75,141.22.192.100,DNS,81,Standard query 0x2abb A sxhtntcwnkpakc.HAW.1X
772,6.979404866,141.22.70.75,141.22.192.100,DNS,77,Standard query 0x2405 A ecffwsyfki.HAW.1X
773,6.979470032,141.22.70.75,141.22.192.100,DNS,78,Standard query 0xa248 A rlhqtrrgimc.HAW.1X
774,6.993497530,141.22.192.100,141.22.70.75,DNS,156,Standard query response 0x2abb No such name A sxhtntcwnkpakc.HAW.1X SOA a.root-servers.net
775,6.993529687,141.22.192.100,141.22.70.75,DNS,152,Standard query response 0x2405 No such name A ecffwsyfki.HAW.1X SOA a.root-servers.net
776,6.993534442,141.22.192.100,141.22.70.75,DNS,153,Standard query response 0xa248 No such name A rlhqtrrgimc.HAW.1X SOA a.root-servers.net
777,6.993680207,141.22.70.75,141.22.192.100,DNS,74,Standard query 0x5a39 A sxhtntcwnkpakc
778,6.993704465,141.22.70.75,141.22.192.100,DNS,71,Standard query 0xaa3f A rlhqtrrgimc
779,6.993745417,141.22.70.75,141.22.192.100,DNS,70,Standard query 0xdffc A ecffwsyfki
780,7.005859621,141.22.192.100,141.22.70.75,DNS,149,Standard query response 0x5a39 No such name A sxhtntcwnkpakc SOA a.root-servers.net
781,7.007540339,141.22.192.100,141.22.70.75,DNS,145,Standard query response 0xdffc No such name A ecffwsyfki SOA a.root-servers.net
782,7.008652311,141.22.192.100,141.22.70.75,DNS,146,Standard query response 0xaa3f No such name A rlhqtrrgimc SOA a.root-servers.net
783,7.074238221,141.22.70.75,141.22.192.100,DNS,75,Standard query 0x8427 A play.google.com
784,7.077240804,141.22.192.100,141.22.70.75,DNS,328,Standard query response 0x8427 A play.google.com CNAME play.l.google.com A 108.177.119.113 A 108.177.119.138 A 108.177.119.139 A 108.177.119.100 A 108.177.119.101 A 108.177.119.102 NS ns4.google.com NS ns1.google.com NS ns2.google.com NS ns3.google.com A 216.239.32.10 A 216.239.34.10 A 216.239.36.10 A 216.239.38.10
799,8.080043745,141.22.70.75,141.22.192.100,DNS,75,Standard query 0x4a67 A www.youtube.com
800,8.083136734,141.22.192.100,141.22.70.75,DNS,309,Standard query response 0x4a67 A www.youtube.com CNAME youtube-ui.l.google.com A 108.177.119.93 A 108.177.119.136 A 108.177.119.190 A 108.177.119.91 NS ns3.google.com NS ns4.google.com NS ns1.google.com NS ns2.google.com A 216.239.32.10 A 216.239.34.10 A 216.239.36.10 A 216.239.38.10
878,9.794798671,141.22.70.75,141.22.192.100,DNS,71,Standard query 0x29be A i.ytimg.com
895,9.798436074,141.22.192.100,141.22.70.75,DNS,348,Standard query response 0x29be A i.ytimg.com CNAME ytimg.l.google.com A 108.177.119.139 A 108.177.127.139 A 108.177.119.100 A 108.177.119.101 A 108.177.119.102 A 108.177.119.113 A 108.177.119.138 NS ns3.google.com NS ns4.google.com NS ns1.google.com NS ns2.google.com A 216.239.32.10 A 216.239.34.10 A 216.239.36.10 A 216.239.38.10
1036,9.956167349,141.22.70.75,141.22.192.100,DNS,75,Standard query 0x29e9 A ssl.gstatic.com
1044,9.958869498,141.22.192.100,141.22.70.75,DNS,234,Standard query response 0x29e9 A ssl.gstatic.com A 108.177.119.94 NS ns2.google.com NS ns3.google.com NS ns4.google.com NS ns1.google.com A 216.239.32.10 A 216.239.34.10 A 216.239.36.10 A 216.239.38.10
1285,28.255412381,141.22.70.75,141.22.192.100,DNS,74,Standard query 0xb6a5 A www.reddit.com
1286,28.255443700,141.22.70.75,141.22.192.101,DNS,74,Standard query 0xb6a5 A www.reddit.com
1287,28.259140815,141.22.192.100,141.22.70.75,DNS,261,Standard query response 0xb6a5 A www.reddit.com CNAME reddit.map.fastly.net A 151.101.113.140 NS ns3.fastly.net NS ns4.fastly.net NS ns1.fastly.net NS ns2.fastly.net A 23.235.32.32 A 104.156.80.32 A 23.235.36.32 A 104.156.84.32
1289,28.268798573,141.22.192.101,141.22.70.75,DNS,261,Standard query response 0xb6a5 A www.reddit.com CNAME reddit.map.fastly.net A 151.101.113.140 NS ns2.fastly.net NS ns3.fastly.net NS ns4.fastly.net NS ns1.fastly.net A 23.235.32.32 A 104.156.80.32 A 23.235.36.32 A 104.156.84.32
1369,29.071068952,141.22.70.75,141.22.192.100,DNS,74,Standard query 0x964a A out.reddit.com
1370,29.073879185,141.22.192.100,141.22.70.75,DNS,435,Standard query response 0x964a A out.reddit.com A 107.23.11.190 A 54.174.14.76 A 54.208.254.144 NS ns-378.awsdns-47.com NS ns-557.awsdns-05.net NS ns-1029.awsdns-00.org NS ns-1887.awsdns-43.co.uk A 205.251.193.122 AAAA 2600:9000:5301:7a00::1 A 205.251.194.45 AAAA 2600:9000:5302:2d00::1 A 205.251.196.5 AAAA 2600:9000:5304:500::1 A 205.251.199.95 AAAA 2600:9000:5307:5f00::1
1381,29.437180855,141.22.70.75,141.22.192.100,DNS,79,Standard query 0xdfdf A www.redditmedia.com
1382,29.445758510,141.22.192.100,141.22.70.75,DNS,266,Standard query response 0xdfdf A www.redditmedia.com CNAME reddit.map.fastly.net A 151.101.113.140 NS ns1.fastly.net NS ns2.fastly.net NS ns3.fastly.net NS ns4.fastly.net A 23.235.32.32 A 104.156.80.32 A 23.235.36.32 A 104.156.84.32
1397,30.139660745,141.22.70.75,141.22.192.100,DNS,81,Standard query 0x8fe5 A c.amazon-adsystem.com
1398,30.143490104,141.22.192.100,141.22.70.75,DNS,449,Standard query response 0x8fe5 A c.amazon-adsystem.com CNAME d1ykf07e75w7ss.cloudfront.net A 52.222.246.223 NS ns-793.awsdns-35.net NS ns-1525.awsdns-62.org NS ns-1763.awsdns-28.co.uk NS ns-89.awsdns-11.com A 205.251.192.89 AAAA 2600:9000:5300:5900::1 A 205.251.195.25 AAAA 2600:9000:5303:1900::1 A 205.251.197.245 AAAA 2600:9000:5305:f500::1 A 205.251.198.227 AAAA 2600:9000:5306:e300::1
1414,30.212456043,141.22.70.75,141.22.192.100,DNS,72,Standard query 0xc8ab A e.reddit.com
1415,30.215679321,141.22.192.100,141.22.70.75,DNS,259,Standard query response 0xc8ab A e.reddit.com CNAME reddit.map.fastly.net A 151.101.113.140 NS ns3.fastly.net NS ns4.fastly.net NS ns1.fastly.net NS ns2.fastly.net A 23.235.32.32 A 104.156.80.32 A 23.235.36.32 A 104.156.84.32
1442,30.342051198,141.22.70.75,141.22.192.100,DNS,84,Standard query 0x1f8f A engine.a.redditmedia.com
1451,30.352554446,141.22.192.100,141.22.70.75,DNS,445,Standard query response 0x1f8f A engine.a.redditmedia.com A 50.17.210.81 A 50.19.214.236 A 54.225.144.2 NS ns-1340.awsdns-39.org NS ns-1715.awsdns-22.co.uk NS ns-264.awsdns-33.com NS ns-698.awsdns-23.net A 205.251.193.8 AAAA 2600:9000:5301:800::1 A 205.251.194.186 AAAA 2600:9000:5302:ba00::1 A 205.251.197.60 AAAA 2600:9000:5305:3c00::1 A 205.251.198.179 AAAA 2600:9000:5306:b300::1
1455,30.448699528,141.22.70.75,141.22.192.100,DNS,83,Standard query 0x4dfd A aax.amazon-adsystem.com
1456,30.451852741,141.22.192.100,141.22.70.75,DNS,383,Standard query response 0x4dfd A aax.amazon-adsystem.com CNAME aax.amazon-adsystem.amazon.com CNAME aax-eu.amazon-adsystem.com A 52.94.218.7 NS ns-923.amazon.com NS ns-931.amazon.com NS ns-932.amazon.com NS ns-911.amazon.com NS ns-912.amazon.com NS ns-921.amazon.com A 52.9.140.222 A 52.9.146.37 A 34.196.62.143 A 52.86.96.73 A 52.19.138.45 A 52.16.221.207
1482,30.661481815,141.22.70.75,141.22.192.100,DNS,84,Standard query 0x8431 A sb.scorecardresearch.com
1484,30.665700791,141.22.192.100,141.22.70.75,DNS,542,Standard query response 0x8431 A sb.scorecardresearch.com CNAME sb.scorecardresearch.com.edgekey.net CNAME e1879.e7.akamaiedge.net A 104.94.187.204 NS n2e7.akamaiedge.net NS n3e7.akamaiedge.net NS n4e7.akamaiedge.net NS n5e7.akamaiedge.net NS n6e7.akamaiedge.net NS n7e7.akamaiedge.net NS a0e7.akamaiedge.net NS a1e7.akamaiedge.net NS n0e7.akamaiedge.net NS n1e7.akamaiedge.net AAAA 2600:1480:e800::c0 AAAA 2600:1480:e800::c0 A 88.221.81.192 A 80.157.150.135 A 80.157.150.135 A 80.157.150.134 A 80.157.150.134 A 80.157.150.133 A 80.157.150.132
1489,30.682437855,141.22.70.75,141.22.192.100,DNS,80,Standard query 0xb6a4 A rules.quantcount.com
1493,30.687551934,141.22.192.100,141.22.70.75,DNS,505,Standard query response 0xb6a4 A rules.quantcount.com CNAME d2fashanjl7d9f.cloudfront.net A 52.222.250.177 A 52.222.250.183 A 52.222.250.204 A 52.222.250.207 A 52.222.250.230 A 52.222.250.7 A 52.222.250.107 A 52.222.250.149 NS ns-416.awsdns-52.com NS ns-701.awsdns-23.net NS ns-1362.awsdns-42.org NS ns-1894.awsdns-44.co.uk A 205.251.193.160 AAAA 2600:9000:5301:a000::1 A 205.251.194.189 AAAA 2600:9000:5302:bd00::1 A 205.251.197.82 A 205.251.199.102
1545,30.794189349,141.22.70.75,141.22.192.100,DNS,80,Standard query 0x5306 A pixel.quantserve.com
1546,30.795175113,141.22.70.75,141.22.192.100,DNS,86,Standard query 0xa485 A aax-eu.amazon-adsystem.com
1547,30.797437741,141.22.192.100,141.22.70.75,DNS,546,Standard query response 0x5306 A pixel.quantserve.com CNAME akamai-pixel.quantserve.com.akadns.net CNAME anycast-europe.quantserve.com.akadns.net A 95.172.94.46 A 95.172.94.50 A 95.172.94.55 A 95.172.94.58 A 95.172.94.15 A 95.172.94.22 A 95.172.94.24 A 95.172.94.31 NS a3-129.akadns.net NS a5-130.akadns.org NS a7-131.akadns.net NS a9-128.akadns.net NS a11-129.akadns.net NS a12-131.akadns.org NS a13-130.akadns.org NS a18-128.akadns.org NS a28-129.akadns.org NS a1-128.akadns.net A 193.108.88.128 A 96.7.49.129
1549,30.799125095,141.22.192.100,141.22.70.75,DNS,331,Standard query response 0xa485 A aax-eu.amazon-adsystem.com A 52.94.218.7 NS ns-921.amazon.com NS ns-923.amazon.com NS ns-931.amazon.com NS ns-932.amazon.com NS ns-911.amazon.com NS ns-912.amazon.com A 52.9.140.222 A 52.9.146.37 A 34.196.62.143 A 52.86.96.73 A 52.19.138.45 A 52.16.221.207
1578,30.846066832,141.22.70.75,141.22.192.100,DNS,90,Standard query 0x92cf A securepubads.g.doubleclick.net
1579,30.849359200,141.22.192.100,141.22.70.75,DNS,326,Standard query response 0x92cf A securepubads.g.doubleclick.net CNAME partnerad.l.doubleclick.net A 108.177.119.155 A 108.177.119.156 A 108.177.119.157 A 108.177.119.154 NS ns2.google.com NS ns3.google.com NS ns4.google.com NS ns1.google.com A 216.239.32.10 A 216.239.34.10 A 216.239.36.10 A 216.239.38.10
1623,31.124630387,141.22.70.75,141.22.192.100,DNS,74,Standard query 0x885c A us-u.openx.net
1624,31.128075643,141.22.192.100,141.22.70.75,DNS,386,Standard query response 0x885c A us-u.openx.net A 173.241.240.143 NS dns1.p04.nsone.net NS dns2.p04.nsone.net NS dns3.p04.nsone.net NS dns4.p04.nsone.net NS ns01.oxdns.net NS ns02.oxdns.net NS ns03.oxdns.net NS ns04.oxdns.net A 198.51.44.4 A 198.51.45.4 A 198.51.44.68 A 198.51.45.68 A 45.54.40.1 A 45.54.40.65 A 45.54.40.129 A 45.54.40.193
1640,31.263173741,141.22.70.75,141.22.192.100,DNS,85,Standard query 0xd8f5 A tpc.googlesyndication.com
1641,31.265649025,141.22.192.100,141.22.70.75,DNS,280,Standard query response 0xd8f5 A tpc.googlesyndication.com CNAME pagead-googlehosted.l.google.com A 108.177.119.132 NS ns2.google.com NS ns3.google.com NS ns4.google.com NS ns1.google.com A 216.239.32.10 A 216.239.34.10 A 216.239.36.10 A 216.239.38.10
1718,32.596426831,141.22.70.75,141.22.192.100,DNS,89,Standard query 0x68b5 A pagead2.googlesyndication.com
1719,32.599719680,141.22.192.100,141.22.70.75,DNS,336,Standard query response 0x68b5 A pagead2.googlesyndication.com CNAME pagead46.l.doubleclick.net A 108.177.127.155 A 108.177.127.156 A 108.177.127.157 A 108.177.127.154 NS ns4.google.com NS ns1.google.com NS ns2.google.com NS ns3.google.com A 216.239.32.10 A 216.239.34.10 A 216.239.36.10 A 216.239.38.10
418,1.135311402,141.22.70.75,54.225.185.25,HTTP,525,GET /public/channel/live/list/game/league-of-legends HTTP/1.1 
420,1.165909814,141.22.70.75,107.21.211.51,HTTP,494,GET /media/live/list HTTP/1.1 
464,1.238566381,54.225.185.25,141.22.70.75,HTTP,71,HTTP/1.1 403 Forbidden  (application/json)
474,1.285397251,141.22.70.75,54.75.238.140,HTTP,568,GET /config?version=1.7.0&browser=chrome&locale=de&monetization=false HTTP/1.1 
483,1.341273245,54.75.238.140,141.22.70.75,HTTP,838,[TCP Previous segment not captured] Continuation
527,1.400537735,107.21.211.51,141.22.70.75,HTTP,1092,[TCP Previous segment not captured] Continuation
736,2.717986629,141.22.70.75,54.75.238.140,HTTP,589,GET /domains?uid=1792177857.1506913019 HTTP/1.1 
752,2.825389362,54.75.238.140,141.22.70.75,HTTP,207,HTTP/1.1 304 Not Modified 
52,0.209398744,141.22.70.75,224.0.0.251,MDNS,82,"Standard query 0x0000 PTR _googlecast._tcp.local, ""QM"" question"
53,0.209454708,fe80::6af7:129:4543:d719,ff02::fb,MDNS,102,"Standard query 0x0000 PTR _googlecast._tcp.local, ""QM"" question"
234,0.759279320,141.22.70.75,224.0.0.251,MDNS,82,"Standard query 0x0000 PTR _googlecast._tcp.local, ""QM"" question"
235,0.759399701,fe80::6af7:129:4543:d719,ff02::fb,MDNS,102,"Standard query 0x0000 PTR _googlecast._tcp.local, ""QM"" question"
236,0.759544626,141.22.70.75,224.0.0.251,MDNS,82,"Standard query 0x0000 PTR _googlecast._tcp.local, ""QM"" question"
237,0.759612658,fe80::6af7:129:4543:d719,ff02::fb,MDNS,102,"Standard query 0x0000 PTR _googlecast._tcp.local, ""QM"" question"
595,1.759995750,141.22.70.75,224.0.0.251,MDNS,82,"Standard query 0x0000 PTR _googlecast._tcp.local, ""QM"" question"
596,1.760053960,fe80::6af7:129:4543:d719,ff02::fb,MDNS,102,"Standard query 0x0000 PTR _googlecast._tcp.local, ""QM"" question"
755,3.761279661,141.22.70.75,224.0.0.251,MDNS,82,"Standard query 0x0000 PTR _googlecast._tcp.local, ""QM"" question"
756,3.761354321,fe80::6af7:129:4543:d719,ff02::fb,MDNS,102,"Standard query 0x0000 PTR _googlecast._tcp.local, ""QM"" question"
757,4.931530906,141.22.70.75,224.0.0.251,MDNS,78,"Standard query 0x0000 PTR _privet._tcp.local, ""QM"" question"
758,4.931774046,fe80::6af7:129:4543:d719,ff02::fb,MDNS,98,"Standard query 0x0000 PTR _privet._tcp.local, ""QM"" question"
769,5.932748762,141.22.70.75,224.0.0.251,MDNS,78,"Standard query 0x0000 PTR _privet._tcp.local, ""QM"" question"
770,5.932870473,fe80::6af7:129:4543:d719,ff02::fb,MDNS,98,"Standard query 0x0000 PTR _privet._tcp.local, ""QM"" question"
797,7.933138854,141.22.70.75,224.0.0.251,MDNS,78,"Standard query 0x0000 PTR _privet._tcp.local, ""QM"" question"
798,7.933213002,fe80::6af7:129:4543:d719,ff02::fb,MDNS,98,"Standard query 0x0000 PTR _privet._tcp.local, ""QM"" question"
1,0.000000000,141.22.70.75,239255255250,SSDP,208,M-SEARCH * HTTP/1.1 
324,1.005858664,141.22.70.75,239255255250,SSDP,208,M-SEARCH * HTTP/1.1 
615,2.006667417,141.22.70.75,239255255250,SSDP,208,M-SEARCH * HTTP/1.1 
754,3.007402200,141.22.70.75,239255255250,SSDP,208,M-SEARCH * HTTP/1.1 
5,0.009881548,141.22.70.75,108177119188,TCP,74,38162  >  5228 [SYN] Seq=0 Win=29200 Len=0 MSS=1460 SACK_PERM=1 TSval=3513056875 TSecr=0 WS=128
7,0.030364927,108177119188,141.22.70.75,TCP,74,"5228  >  38162 [SYN, ACK] Seq=0 Ack=1 Win=42408 Len=0 MSS=1380 SACK_PERM=1 TSval=2681849886 TSecr=3513056875 WS=256"
8,0.030407584,141.22.70.75,108177119188,TCP,66,38162  >  5228 [ACK] Seq=1 Ack=1 Win=29312 Len=0 TSval=3513056880 TSecr=2681849886
9,0.030803132,141.22.70.75,108177119188,TCP,252,"38162  >  5228 [PSH, ACK] Seq=1 Ack=1 Win=29312 Len=186 TSval=3513056880 TSecr=2681849886"
10,0.050262030,108177119188,141.22.70.75,TCP,66,5228  >  38162 [ACK] Seq=1 Ack=187 Win=43520 Len=0 TSval=2681849907 TSecr=3513056880
11,0.050953339,108177119188,141.22.70.75,TCP,330,"[TCP Previous segment not captured] 5228  >  38162 [PSH, ACK] Seq=4105 Ack=187 Win=43520 Len=264 TSval=2681849907 TSecr=3513056880"
12,0.050974759,141.22.70.75,108177119188,TCP,78,[TCP Window Update] 38162  >  5228 [ACK] Seq=187 Ack=1 Win=30336 Len=0 TSval=3513056885 TSecr=2681849907 SLE=4105 SRE=4369
13,0.053634791,108177119188,141.22.70.75,TCP,4170,[TCP Out-Of-Order] 5228  >  38162 [ACK] Seq=1 Ack=187 Win=43520 Len=4104 TSval=2681849907 TSecr=3513056880
14,0.053655639,141.22.70.75,108177119188,TCP,66,38162  >  5228 [ACK] Seq=187 Ack=4369 Win=38528 Len=0 TSval=3513056886 TSecr=2681849907
15,0.060807958,141.22.70.75,108177119188,TCP,324,"38162  >  5228 [PSH, ACK] Seq=187 Ack=4369 Win=38528 Len=258 TSval=3513056887 TSecr=2681849907"
16,0.080478647,108177119188,141.22.70.75,TCP,387,"5228  >  38162 [PSH, ACK] Seq=4369 Ack=445 Win=44800 Len=321 TSval=2681849937 TSecr=3513056887"
17,0.094552664,141.22.70.75,108177119188,TCP,471,"38162  >  5228 [PSH, ACK] Seq=445 Ack=4690 Win=41216 Len=405 TSval=3513056896 TSecr=2681849937"
20,0.107966183,141.22.70.75,108.177.119.95,TCP,74,55026  >  443 [SYN] Seq=0 Win=29200 Len=0 MSS=1460 SACK_PERM=1 TSval=485824118 TSecr=0 WS=128
21,0.114410100,108177119188,141.22.70.75,TCP,96,"5228  >  38162 [PSH, ACK] Seq=4690 Ack=850 Win=45824 Len=30 TSval=2681849971 TSecr=3513056896"
22,0.117895081,108177119188,141.22.70.75,TCP,184,"5228  >  38162 [PSH, ACK] Seq=4720 Ack=850 Win=45824 Len=118 TSval=2681849974 TSecr=3513056896"
23,0.117938459,141.22.70.75,108177119188,TCP,66,38162  >  5228 [ACK] Seq=850 Ack=4838 Win=41216 Len=0 TSval=3513056902 TSecr=2681849971
24,0.118738913,108177119188,141.22.70.75,TCP,213,"5228  >  38162 [PSH, ACK] Seq=4838 Ack=850 Win=45824 Len=147 TSval=2681849976 TSecr=3513056896"
25,0.126837290,108.177.119.95,141.22.70.75,TCP,74,"443  >  55026 [SYN, ACK] Seq=0 Ack=1 Win=42408 Len=0 MSS=1380 SACK_PERM=1 TSval=721889385 TSecr=485824118 WS=256"
26,0.126871887,141.22.70.75,108.177.119.95,TCP,66,55026  >  443 [ACK] Seq=1 Ack=1 Win=29312 Len=0 TSval=485824123 TSecr=721889385
28,0.149535018,108.177.119.95,141.22.70.75,TCP,66,443  >  55026 [ACK] Seq=1 Ack=209 Win=43520 Len=0 TSval=721889408 TSecr=485824124
30,0.150350402,141.22.70.75,108.177.119.95,TCP,78,[TCP Window Update] 55026  >  443 [ACK] Seq=209 Ack=1 Win=30720 Len=0 TSval=485824129 TSecr=721889408 SLE=2737 SRE=3497
31,0.151602588,108.177.119.95,141.22.70.75,TCP,2802,[TCP Out-Of-Order] 443  >  55026 [ACK] Seq=1 Ack=209 Win=43520 Len=2736 TSval=721889408 TSecr=485824124
32,0.151623169,141.22.70.75,108.177.119.95,TCP,66,55026  >  443 [ACK] Seq=209 Ack=3497 Win=36224 Len=0 TSval=485824129 TSecr=721889408
36,0.161055723,141.22.70.75,108177119188,TCP,66,38162  >  5228 [ACK] Seq=850 Ack=4985 Win=44032 Len=0 TSval=3513056913 TSecr=2681849976
40,0.178550168,141.22.70.75,108.177.119.95,TCP,66,55026  >  443 [ACK] Seq=643 Ack=3888 Win=39040 Len=0 TSval=485824136 TSecr=721889430
44,0.182342110,141.22.70.75,108.177.119.95,TCP,66,55026  >  443 [ACK] Seq=681 Ack=5303 Win=44416 Len=0 TSval=485824137 TSecr=721889440
47,0.182419952,141.22.70.75,108.177.119.95,TCP,66,55026  >  443 [ACK] Seq=681 Ack=5427 Win=44416 Len=0 TSval=485824137 TSecr=721889440
50,0.203827229,108.177.119.95,141.22.70.75,TCP,66,443  >  55026 [ACK] Seq=5427 Ack=727 Win=44800 Len=0 TSval=721889463 TSecr=485824136
54,0.209971513,141.22.70.75,108.177.119.95,TCP,74,55028  >  443 [SYN] Seq=0 Win=29200 Len=0 MSS=1460 SACK_PERM=1 TSval=485824144 TSecr=0 WS=128
57,0.228835128,108.177.119.95,141.22.70.75,TCP,74,"443  >  55028 [SYN, ACK] Seq=0 Ack=1 Win=42408 Len=0 MSS=1380 SACK_PERM=1 TSval=2947968322 TSecr=485824144 WS=256"
58,0.228863353,141.22.70.75,108.177.119.95,TCP,66,55028  >  443 [ACK] Seq=1 Ack=1 Win=29312 Len=0 TSval=485824148 TSecr=2947968322
61,0.229953403,141.22.70.75,108.177.119.84,TCP,74,60106  >  443 [SYN] Seq=0 Win=29200 Len=0 MSS=1460 SACK_PERM=1 TSval=445280260 TSecr=0 WS=128
63,0.230517915,141.22.70.75,216.58.213.227,TCP,74,59380  >  443 [SYN] Seq=0 Win=29200 Len=0 MSS=1460 SACK_PERM=1 TSval=1743461593 TSecr=0 WS=128
64,0.248375526,108.177.119.95,141.22.70.75,TCP,66,443  >  55028 [ACK] Seq=1 Ack=203 Win=43520 Len=0 TSval=2947968341 TSecr=485824148
66,0.250244313,141.22.70.75,108.177.119.95,TCP,78,[TCP Window Update] 55028  >  443 [ACK] Seq=203 Ack=1 Win=30848 Len=0 TSval=485824154 TSecr=2947968341 SLE=2737 SRE=3498
67,0.251357293,108.177.119.84,141.22.70.75,TCP,74,"443  >  60106 [SYN, ACK] Seq=0 Ack=1 Win=42408 Len=0 MSS=1380 SACK_PERM=1 TSval=3209460848 TSecr=445280260 WS=256"
68,0.251391974,141.22.70.75,108.177.119.84,TCP,66,60106  >  443 [ACK] Seq=1 Ack=1 Win=29312 Len=0 TSval=445280265 TSecr=3209460848
69,0.251403656,216.58.213.227,141.22.70.75,TCP,74,"443  >  59380 [SYN, ACK] Seq=0 Ack=1 Win=42408 Len=0 MSS=1380 SACK_PERM=1 TSval=2418847537 TSecr=1743461593 WS=256"
70,0.251414148,141.22.70.75,216.58.213.227,TCP,66,59380  >  443 [ACK] Seq=1 Ack=1 Win=29312 Len=0 TSval=1743461598 TSecr=2418847537
71,0.251425784,108.177.119.95,141.22.70.75,TCP,2802,[TCP Out-Of-Order] 443  >  55028 [ACK] Seq=1 Ack=203 Win=43520 Len=2736 TSval=2947968341 TSecr=485824148
72,0.251434899,141.22.70.75,108.177.119.95,TCP,66,55028  >  443 [ACK] Seq=203 Ack=3498 Win=36224 Len=0 TSval=485824154 TSecr=2947968341
78,0.294326532,108.177.119.84,141.22.70.75,TCP,66,443  >  60106 [ACK] Seq=1 Ack=208 Win=43520 Len=0 TSval=3209460893 TSecr=445280271
79,0.294699684,216.58.213.227,141.22.70.75,TCP,66,443  >  59380 [ACK] Seq=1 Ack=202 Win=43520 Len=0 TSval=2418847582 TSecr=1743461604
81,0.299255669,141.22.70.75,108.177.119.84,TCP,66,60106  >  443 [ACK] Seq=208 Ack=1369 Win=32000 Len=0 TSval=445280277 TSecr=3209460894
82,0.299271459,108.177.119.84,141.22.70.75,TCP,1163,"[TCP Previous segment not captured] 443  >  60106 [PSH, ACK] Seq=2737 Ack=208 Win=43520 Len=1097 TSval=3209460894 TSecr=445280271 [TCP segment of a reassembled PDU], Server Key Exchange, Server Hello Done"
83,0.299277328,141.22.70.75,108.177.119.84,TCP,78,[TCP Window Update] 60106  >  443 [ACK] Seq=208 Ack=1369 Win=34688 Len=0 TSval=445280277 TSecr=3209460894 SLE=2737 SRE=3834
85,0.299290529,141.22.70.75,216.58.213.227,TCP,78,[TCP Window Update] 59380  >  443 [ACK] Seq=202 Ack=1 Win=30336 Len=0 TSval=1743461610 TSecr=2418847582 SLE=2737 SRE=2947
86,0.299300501,108.177.119.84,141.22.70.75,TCP,1434,[TCP Out-Of-Order] 443  >  60106 [ACK] Seq=1369 Ack=208 Win=43520 Len=1368 TSval=3209460894 TSecr=445280271
87,0.299305863,141.22.70.75,108.177.119.84,TCP,66,60106  >  443 [ACK] Seq=208 Ack=3834 Win=37504 Len=0 TSval=445280277 TSecr=3209460894
88,0.299309120,216.58.213.227,141.22.70.75,TCP,2802,[TCP Out-Of-Order] 443  >  59380 [ACK] Seq=1 Ack=202 Win=43520 Len=2736 TSval=2418847583 TSecr=1743461604
89,0.299312941,141.22.70.75,216.58.213.227,TCP,66,59380  >  443 [ACK] Seq=202 Ack=2947 Win=35840 Len=0 TSval=1743461610 TSecr=2418847583
94,0.314878349,141.22.70.75,108.177.119.95,TCP,78,[TCP Dup ACK 92#1] 55028  >  443 [ACK] Seq=389 Ack=3851 Win=39040 Len=0 TSval=485824170 TSecr=2947968407 SLE=3782 SRE=3851
106,0.327689614,141.22.70.75,108.177.119.95,TCP,74,55034  >  443 [SYN] Seq=0 Win=29200 Len=0 MSS=1460 SACK_PERM=1 TSval=485824173 TSecr=0 WS=128
112,0.331372115,141.22.70.75,108.177.119.95,TCP,66,55028  >  443 [ACK] Seq=1350 Ack=3889 Win=39040 Len=0 TSval=485824174 TSecr=2947968424
113,0.343319965,108.177.119.95,141.22.70.75,TCP,66,443  >  55028 [ACK] Seq=3889 Ack=684 Win=44800 Len=0 TSval=2947968437 TSecr=485824172
114,0.344019674,108.177.119.95,141.22.70.75,TCP,66,443  >  55028 [ACK] Seq=3889 Ack=1350 Win=46848 Len=0 TSval=2947968437 TSecr=485824172
117,0.346887529,108.177.119.84,141.22.70.75,TCP,66,443  >  60106 [ACK] Seq=4262 Ack=1694 Win=47360 Len=0 TSval=3209460946 TSecr=445280284
118,0.347562554,108.177.119.95,141.22.70.75,TCP,74,"443  >  55034 [SYN, ACK] Seq=0 Ack=1 Win=42408 Len=0 MSS=1380 SACK_PERM=1 TSval=4034934516 TSecr=485824173 WS=256"
119,0.347595404,141.22.70.75,108.177.119.95,TCP,66,55034  >  443 [ACK] Seq=1 Ack=1 Win=29312 Len=0 TSval=485824178 TSecr=4034934516
121,0.349137067,141.22.70.75,216.58.213.227,TCP,66,59380  >  443 [ACK] Seq=1251 Ack=3375 Win=38528 Len=0 TSval=1743461623 TSecr=2418847633
124,0.358955197,141.22.70.75,108.177.119.84,TCP,66,60106  >  443 [ACK] Seq=1733 Ack=5056 Win=45696 Len=0 TSval=445280292 TSecr=3209460944
130,0.360690835,141.22.70.75,108.177.119.84,TCP,66,60106  >  443 [ACK] Seq=1733 Ack=5409 Win=48384 Len=0 TSval=445280292 TSecr=3209460959
135,0.364860599,141.22.70.75,108.177.119.95,TCP,66,55028  >  443 [ACK] Seq=1350 Ack=4200 Win=41728 Len=0 TSval=485824182 TSecr=2947968458
136,0.364875558,141.22.70.75,216.58.213.227,TCP,66,59380  >  443 [ACK] Seq=1289 Ack=3811 Win=44032 Len=0 TSval=1743461626 TSecr=2418847651
139,0.364890806,141.22.70.75,108.177.119.95,TCP,66,55028  >  443 [ACK] Seq=1350 Ack=5273 Win=44416 Len=0 TSval=485824182 TSecr=2947968458
141,0.364898734,141.22.70.75,108.177.119.95,TCP,66,55028  >  443 [ACK] Seq=1350 Ack=5319 Win=44416 Len=0 TSval=485824182 TSecr=2947968458
143,0.370012707,141.22.70.75,108.177.119.95,TCP,66,55028  >  443 [ACK] Seq=1350 Ack=5375 Win=44416 Len=0 TSval=485824184 TSecr=2947968463
145,0.371239539,141.22.70.75,108.177.119.95,TCP,66,55028  >  443 [ACK] Seq=1350 Ack=5627 Win=47232 Len=0 TSval=485824184 TSecr=2947968463
147,0.371261262,141.22.70.75,108.177.119.95,TCP,66,55028  >  443 [ACK] Seq=1350 Ack=5913 Win=49920 Len=0 TSval=485824184 TSecr=2947968463
148,0.379599040,108.177.119.95,141.22.70.75,TCP,66,443  >  55034 [ACK] Seq=1 Ack=216 Win=43520 Len=0 TSval=4034934548 TSecr=485824181
150,0.380378635,141.22.70.75,108.177.119.95,TCP,78,[TCP Window Update] 55034  >  443 [ACK] Seq=216 Ack=1 Win=30848 Len=0 TSval=485824186 TSecr=4034934548 SLE=2737 SRE=3502
151,0.380409648,108.177.119.95,141.22.70.75,TCP,2802,[TCP Out-Of-Order] 443  >  55034 [ACK] Seq=1 Ack=216 Win=43520 Len=2736 TSval=4034934548 TSecr=485824181
152,0.380424463,141.22.70.75,108.177.119.95,TCP,66,55034  >  443 [ACK] Seq=216 Ack=3502 Win=36224 Len=0 TSval=485824186 TSecr=4034934548
157,0.403522432,216.58.213.227,141.22.70.75,TCP,66,443  >  59380 [ACK] Seq=3857 Ack=1335 Win=46080 Len=0 TSval=2418847691 TSecr=1743461625
164,0.431653244,108.177.119.84,141.22.70.75,TCP,66,443  >  60106 [ACK] Seq=5409 Ack=2091 Win=49664 Len=0 TSval=3209461031 TSecr=445280298
165,0.436102114,108.177.119.95,141.22.70.75,TCP,66,443  >  55028 [ACK] Seq=5913 Ack=1580 Win=47872 Len=0 TSval=2947968530 TSecr=485824188
170,0.455836651,141.22.70.75,108.177.119.95,TCP,78,[TCP Dup ACK 166#1] 55034  >  443 [ACK] Seq=968 Ack=3892 Win=39040 Len=0 TSval=485824205 TSecr=4034934624 SLE=3823 SRE=3892
172,0.456304293,141.22.70.75,108.177.119.95,TCP,66,55034  >  443 [ACK] Seq=968 Ack=3930 Win=39040 Len=0 TSval=485824205 TSecr=4034934625
173,0.467887309,108.177.119.95,141.22.70.75,TCP,66,443  >  55034 [ACK] Seq=3930 Ack=968 Win=45824 Len=0 TSval=4034934636 TSecr=485824203
174,0.470659831,108.177.119.95,141.22.70.75,TCP,66,443  >  55026 [ACK] Seq=5427 Ack=924 Win=45824 Len=0 TSval=721889689 TSecr=485824194
178,0.472903132,141.22.70.75,108.177.119.84,TCP,66,60106  >  443 [ACK] Seq=2164 Ack=6052 Win=53888 Len=0 TSval=445280320 TSecr=3209461070
181,0.480472585,141.22.70.75,108.177.119.95,TCP,66,55034  >  443 [ACK] Seq=968 Ack=4160 Win=41728 Len=0 TSval=485824211 TSecr=4034934649
183,0.480884447,141.22.70.75,108.177.119.95,TCP,66,55034  >  443 [ACK] Seq=968 Ack=4401 Win=44416 Len=0 TSval=485824211 TSecr=4034934649
185,0.481789775,141.22.70.75,108.177.119.95,TCP,78,[TCP Window Update] 55034  >  443 [ACK] Seq=968 Ack=4401 Win=47232 Len=0 TSval=485824212 TSecr=4034934649 SLE=4471 SRE=4517
186,0.481800108,108.177.119.95,141.22.70.75,TCP,136,"[TCP Out-Of-Order] 443  >  55034 [PSH, ACK] Seq=4401 Ack=968 Win=45824 Len=70 TSval=4034934650 TSecr=485824205"
187,0.481809290,141.22.70.75,108.177.119.95,TCP,66,55034  >  443 [ACK] Seq=968 Ack=4517 Win=47232 Len=0 TSval=485824212 TSecr=4034934650
194,0.521224078,141.22.70.75,108.177.119.95,TCP,66,55026  >  443 [ACK] Seq=924 Ack=6186 Win=49920 Len=0 TSval=485824222 TSecr=721889777
197,0.521845388,141.22.70.75,108.177.119.95,TCP,66,55028  >  443 [ACK] Seq=1580 Ack=6711 Win=52736 Len=0 TSval=485824222 TSecr=2947968615
200,0.532907947,108.177.119.84,141.22.70.75,TCP,66,443  >  60106 [ACK] Seq=6052 Ack=2210 Win=49664 Len=0 TSval=3209461092 TSecr=445280321
201,0.540982622,108.177.119.95,141.22.70.75,TCP,66,443  >  55034 [ACK] Seq=4517 Ack=1014 Win=45824 Len=0 TSval=4034934670 TSecr=485824212
202,0.541382576,108.177.119.95,141.22.70.75,TCP,66,443  >  55026 [ACK] Seq=6186 Ack=970 Win=45824 Len=0 TSval=721889800 TSecr=485824222
203,0.581391783,108.177.119.95,141.22.70.75,TCP,66,443  >  55028 [ACK] Seq=6711 Ack=1626 Win=47872 Len=0 TSval=2947968635 TSecr=485824222
204,0.641574086,141.22.70.75,108.177.119.84,TCP,74,60112  >  443 [SYN] Seq=0 Win=29200 Len=0 MSS=1460 SACK_PERM=1 TSval=445280363 TSecr=0 WS=128
205,0.660854109,108.177.119.84,141.22.70.75,TCP,74,"443  >  60112 [SYN, ACK] Seq=0 Ack=1 Win=42408 Len=0 MSS=1380 SACK_PERM=1 TSval=892016758 TSecr=445280363 WS=256"
206,0.660897795,141.22.70.75,108.177.119.84,TCP,66,60112  >  443 [ACK] Seq=1 Ack=1 Win=29312 Len=0 TSval=445280367 TSecr=892016758
210,0.683193861,108.177.119.84,141.22.70.75,TCP,66,443  >  60112 [ACK] Seq=1 Ack=204 Win=43520 Len=0 TSval=892016781 TSecr=445280368
211,0.684937099,108.177.119.84,141.22.70.75,TCP,1159,"[TCP Previous segment not captured] 443  >  60112 [PSH, ACK] Seq=2737 Ack=204 Win=43520 Len=1093 TSval=892016782 TSecr=445280368"
212,0.684972385,141.22.70.75,108.177.119.84,TCP,78,[TCP Window Update] 60112  >  443 [ACK] Seq=204 Ack=1 Win=31488 Len=0 TSval=445280373 TSecr=892016781 SLE=2737 SRE=3830
213,0.685001799,108.177.119.84,141.22.70.75,TCP,2802,[TCP Out-Of-Order] 443  >  60112 [ACK] Seq=1 Ack=204 Win=43520 Len=2736 TSval=892016782 TSecr=445280368
214,0.685054357,141.22.70.75,108.177.119.84,TCP,66,60112  >  443 [ACK] Seq=204 Ack=3830 Win=36864 Len=0 TSval=445280374 TSecr=892016782
219,0.697248740,108.177.119.95,141.22.70.75,TCP,66,443  >  55028 [ACK] Seq=6711 Ack=1700 Win=47872 Len=0 TSval=2947968791 TSecr=485824261
220,0.697736324,108.177.119.95,141.22.70.75,TCP,66,443  >  55028 [ACK] Seq=6711 Ack=2034 Win=48896 Len=0 TSval=2947968791 TSecr=485824261
223,0.706073391,141.22.70.75,108.177.119.84,TCP,66,60112  >  443 [ACK] Seq=758 Ack=4183 Win=39680 Len=0 TSval=445280379 TSecr=892016803
226,0.707758545,108.177.119.84,141.22.70.75,TCP,66,443  >  60112 [ACK] Seq=4221 Ack=758 Win=44800 Len=0 TSval=892016805 TSecr=445280374
231,0.736511288,141.22.70.75,108.177.119.95,TCP,66,55028  >  443 [ACK] Seq=2034 Ack=7196 Win=55424 Len=0 TSval=485824275 TSecr=2947968826
233,0.749057175,141.22.70.75,108.177.119.84,TCP,66,60112  >  443 [ACK] Seq=796 Ack=4221 Win=39680 Len=0 TSval=445280390 TSecr=892016805
238,0.764718557,108.177.119.84,141.22.70.75,TCP,66,443  >  60112 [ACK] Seq=4221 Ack=796 Win=44800 Len=0 TSval=892016823 TSecr=445280379
244,0.805948571,141.22.70.75,108177119100,TCP,74,43032  >  443 [SYN] Seq=0 Win=29200 Len=0 MSS=1460 SACK_PERM=1 TSval=2960777343 TSecr=0 WS=128
246,0.807601926,141.22.70.75,108177119154,TCP,74,34418  >  443 [SYN] Seq=0 Win=29200 Len=0 MSS=1460 SACK_PERM=1 TSval=835737180 TSecr=0 WS=128
247,0.812382064,108.177.119.95,141.22.70.75,TCP,66,443  >  55028 [ACK] Seq=7196 Ack=2080 Win=48896 Len=0 TSval=2947968866 TSecr=485824276
248,0.815638408,108.177.119.95,141.22.70.75,TCP,66,443  >  55028 [ACK] Seq=7196 Ack=2153 Win=48896 Len=0 TSval=2947968909 TSecr=485824290
249,0.816046876,108.177.119.95,141.22.70.75,TCP,66,443  >  55028 [ACK] Seq=7196 Ack=2397 Win=49920 Len=0 TSval=2947968909 TSecr=485824290
250,0.825886731,108177119100,141.22.70.75,TCP,74,"443  >  43032 [SYN, ACK] Seq=0 Ack=1 Win=42408 Len=0 MSS=1380 SACK_PERM=1 TSval=2140020205 TSecr=2960777343 WS=256"
251,0.825924195,141.22.70.75,108177119100,TCP,66,43032  >  443 [ACK] Seq=1 Ack=1 Win=29312 Len=0 TSval=2960777348 TSecr=2140020205
253,0.826833537,108177119154,141.22.70.75,TCP,74,"443  >  34418 [SYN, ACK] Seq=0 Ack=1 Win=42408 Len=0 MSS=1380 SACK_PERM=1 TSval=81200710 TSecr=835737180 WS=256"
254,0.826847512,141.22.70.75,108177119154,TCP,66,34418  >  443 [ACK] Seq=1 Ack=1 Win=29312 Len=0 TSval=835737185 TSecr=81200710
257,0.827756239,141.22.70.75,108.177.119.84,TCP,66,60112  >  443 [ACK] Seq=796 Ack=4513 Win=42368 Len=0 TSval=445280409 TSecr=892016925
259,0.829103355,141.22.70.75,108.177.119.84,TCP,66,60112  >  443 [ACK] Seq=796 Ack=5211 Win=45184 Len=0 TSval=445280410 TSecr=892016925
